course,term,number,title,chapter,number_alt,tags
Lineare Algebra 1,WS&2016,1,Naive Aussagenlogik,0,,Aussage&Negation&Konjunktion&Disjunktion&Implikation&Äquivalenz&Beweisen&Existenz- und Allquantor
Lineare Algebra 1,WS&2016,2,Naive Mengenlehre,0,,Menge&Teilmenge&Durchschnitt&Vereinigung&kartesisches Produkt&Potenzmenge&Kardinalität&vollständige Induktion
Lineare Algebra 1,WS&2016,3,Relationen,0,,Relation&Ordnungsrelation&größtes Element&maximales Element&Äquivalenzrelation&Äquivalenzklasse&Partition&Faktormenge
Lineare Algebra 1,WS&2016,4,Abbildungen,0,,Abbildung&Bild&Urbild&Einschränkung&Komposition von Abbildungen&injektive Abbildung&surjektive Abbildung&Bijektivität&Charakterisierung von Bijektivität&Umkehrabbildung&Auswahlaxiom
Lineare Algebra 1,WS&2016,5,Gruppen,1,,Verknüpfung&Monoid&Gruppe&abelsche Gruppe&symmetrische Gruppe&Permutation&Gruppe der Restklassen modulo n&Gruppenhomomorphismus
Lineare Algebra 1,WS&2016,6,Ringe und Körper,1,,Integritätsbereich&Körper&endlicher Körper&Charakteristik
Lineare Algebra 1,WS&2016,7,Polynome,1,,Polynom&Grad&Polynomdivision&Nullstelle eines Polynoms und deren Vielfachheit&Fundamentalsatz der Algebra&Polynomfunktion
Lineare Algebra 1,WS&2016,8,Vektorräume,2,,Vektorraum&Untervektorraum&Linearkombination&lineare Hülle&lineare Unabhängigkeit in Vektorräumen
Lineare Algebra 1,WS&2016,9,Basis und Dimension,2,,Erzeugendensystem eines Vektorraums&Basis eines Vektorraums&Basisauswahlsatz&Austauschlemma&Austauschsatz&Dimension&Dimension von Untervektorräumen&Basisergänzungssatz&Zornsches Lemma&Existenz von Basen von Vektorräumen
Lineare Algebra 1,WS&2016,10,Matrizen,2,,Matrix&invertierbare Matrix&allgemeine lineare Gruppe&elementare Zeilenumformung&Zeilenraum&Zeilenstufenform&Algorithmus zur Zeilenstufenform&transponierte Matrix&Zeilenrang&Spaltenrang
Lineare Algebra 1,WS&2016,11,Summen von Untervektorräumen,2,,Summe von Untervektorräumen&Dimensionsformel für Summen von Untervektorräumen&direkte Summe von Untervektorräumen&komplementärer Untervektorraum
Lineare Algebra 1,WS&2016,12,Lineare Abbildungen,3,,lineare Abbildung&Endomorphismus eines Vektorraums&Isomorphismus von Vektorräumen&Kern einer linearen Abbildung&Bild einer linearen Abbildung&Rang einer linearen Abbildung&Rang einer Matrix&Dimensionsformel für lineare Abbildungen
Lineare Algebra 1,WS&2016,13,Faktorräume und der Homomorphiesatz,3,,affiner Unterraum&Fasern einer linearen Abbildung&Dimension von Fasern&Faktorraum&Charakterisierung von Untervektorräumen und affinen Unterräumen&Homomorphiesatz
Lineare Algebra 1,WS&2016,14,Lineare Gleichungssysteme,3,,Lineares Gleichungssystem (LGS)&Lösbarkeitskriterien für LGS&strenge Zeilenstufenform&Gauß-Algorithmus für homogene und inhomogene LGS
Lineare Algebra 1,WS&2016,15,Lineare Abildungen und Matrizen,3,,Konstruktion linearer Abbildungen durch Vorgabe auf Basen&Koordinatensystem&Darstellungsmatrix einer linearen Abbildung&Charakterisierung von Invertierbarkeit von Matrizen
Lineare Algebra 1,WS&2016,16,Basiswechsel,3,,Transformationsmatrix&Transformationsformel&Äquivalenz von Matrizen&Ähnlichkeit von Matrizen
Lineare Algebra 1,WS&2016,17,Determinanten,3,,Determinante&Eigenschaften der Determinante&Signum einer Permutation&Transposition&alternierende Gruppe&Leibnizformel&Determinante der Transponierten&komplementäre Matrix&Entwicklungssatz von Laplace&Cramersche Regel&Determinante eines Endomorphismus
Lineare Algebra 2,SS&2017,18,Eigenwerte,3,,Eigenwert&Charakterisierungen von Diagonalisierbarkeit&Eigenraum&charakteristisches Polynom einer Matrix&charakteristisches Polynom eines Endomorphismus&algebraische Vielfachheit eines Eigenwerts&Satz von Cayley-Hamilton&Minimalpolynom eines Endomorphismus
Lineare Algebra 2,SS&2017,19,Dualraum,3,,Dualraum&Linearform&duale Basis&Annullator&duale Abbildung&Bidualraum
Lineare Algebra 2,SS&2017,20,Bilinearformen,4,,Bilinearform&Darstellungsmatrix einer Bilinearform&Transformationsformel für die Darstellungsmatrix einer Bilinearform&nicht-ausgeartete Bilinearform&perfekte Bilinearform&symmetrische Bilinearform&antisymmetrische Bilinearform&alternierende Bilinearform
Lineare Algebra 2,SS&2017,21,Quadratische Räume,4,,quadratische Form&quadratischer Raum&Homomorphismus quadratischer Räume&Existenz von Orthogonalbasen quadratischer Räume&Klassifikation quadratischer Räume über C und R&Sylvesterscher Trägheitssatz
Lineare Algebra 2,SS&2017,22,Euklidische Räume,4,,Euklidischer Raum&Norm&orthogonales Komplement&Orthogonalprojektion&Gram-Schmidt-Verfahren&positiv definite Matrix&Cauchy-Schwarz-Ungleichung&Eigenschaften der Norm
Lineare Algebra 2,SS&2017,23,Orthogonale Gruppe,4,,orthogonale Abbildungen und Matrizen&orthogonale und spezielle orthogonale Gruppe&O(2)
Lineare Algebra 2,SS&2017,24,Spektralsatz,4,,adjungierte Abbildung&selbstadjungierter Endomorphismus&selbstadjungierter Endomorphismus&Spektralsatz für selbstadjungierte Endomorphismen&Hauptachsentransformation
Lineare Algebra 2,SS&2017,25,Unitäre Räume,4,,Sesquilinearform&hermitesche Form&unitärer Raum&normaler Endomorphismus&Spektralsatz für normale Endomorphismen&Ring&Ringhomomorphismus&Ideal&Restklasse&Faktorring
Lineare Algebra 2,SS&2017,26,"Ringe, Ideale und Teilbarkeit",5,,Ring&Ringhomomorphismus&Ideal&Restklasse&Faktorring&Nullteiler&Einheit&nullteilerfreier Ring&Teiler&größter gemeinsamer Teiler&irreduzibles Element&Primelement&faktorieller Ring&HIR sind faktoriell
Lineare Algebra 2,SS&2017,27,Euklidische Ringe,5,,Euklidischer Ring&Euklidische Ringe sind faktoriell&Euklidischer Algorithmus&Gauß-Diagonalisierung von Matrizen über Euklidischen Ringen&Äquivalenz und Ähnlichkeit von Matrizen über Ringen&Fittingideale&Fittings Lemma&Elementarteilersatz für Matrizen über Euklidischen Ringen
Lineare Algebra 2,SS&2017,28,Normalformen von Endomorphismen,5,,charakteristische Matrix eines Endomorphismus&Satz von Frobenius&Invarianten- und Determinantenteiler einer Matrix&Invariantenteilersatz&Begleitmatrix&Frobenius-Normalform&Weierstrass-Normalform&Jordanmatrix&Jordansche Normalform
Lineare Algebra 2,SS&2017,29,Moduln,5,,Modul&Modulhomomorphismus&Untermodul&Faktormodul&Erzeugendensystem eines Moduls&lineare Unabhängigkeit in Moduln&Basis eines freien Moduls&freier Modul&Torsionsuntermodul&Länge eines Moduls&Länge einer direkten Summe von Moduln
Lineare Algebra 2,SS&2017,30,Moduln über Hauptidealringen,5,,Rang eines endlich freien Moduls über einem HIR&Diagonalisierung von Matrizen über einem HIR&Elementarteilersatz für Untermoduln endlich freier Moduln über HIR&Hauptsatz für endlich erzeugte Moduln über HIR&Hauptsatz für endlich erzeugte abelsche Gruppen&Chinesischer Restsatz über HIR
Algebra 1,WS&2016,1,"Monoide, Gruppen und Homomorphismen",1,,Monoid&Untermonoid&inverses Element&Gruppe&Gruppenordnung&Untergruppe&Untergruppenkriterium&Erzeugnis (gruppentheoretisch)&zyklische Gruppe&Gruppenhomomorphismus&Kern eines Gruppenhomomorphismus&Bild eines Gruppenhomomorphismus&Isomorphismus von Gruppen&Satz von Cayley
Algebra 1,WS&2016,2,Normalteiler und Faktorgruppen,1,,Linksnebenklasse&Index einer Untergruppe&Satz von Lagrange&Normalteiler&Faktorgruppe&kanonische Projektion auf Faktorgruppe&Homomorphiesatz für Gruppen&Isomorphiesätze für Gruppen
Algebra 1,WS&2016,3,Zyklische Gruppen,1,,zyklische Gruppe&Ordnung eines Gruppenelements&Kleiner Satz von Fermat&Hauptsatz für endlich erzeugte abelsche Gruppen
Algebra 1,WS&2016,4,Ringe und Ideale,2,,Ring&Ideal&Hauptideal&Hauptidealring (HIR)&Restklasse&Faktorring&Nullteiler&Einheit&nullteilerfreier Ring&relativ prime Ideale&Chinesischer Restsatz
Algebra 1,WS&2016,5,Primideale und maximale Ideale,2,,Primideal&maximales Ideal
Algebra 1,WS&2016,6,Polynomringe,2,,Polynomring&Polynomdivision&Nullstelle eines Polynoms und deren Vielfachheit
Algebra 1,WS&2016,7,Teilbarkeit und Primfaktorzerlegung,2,,Teiler&assoziierte Ringelemente&irreduzibles Element&Primelement&faktorieller Ring&Euklidischer Ring&Euklidische Ringe sind HIR&Euklidische Ringe sind faktoriell&Euklidischer Algorithmus
Algebra 1,WS&2016,8,Lokalisierung,2,,Quotientenringe und-körper&universelle Eigenschaft von Quotientenringen
Algebra 1,WS&2016,9,Der Satz von Gauß und Irreduzibilitätskriterien für Polynome,2,,Satz von Gauß über Polynomringe&Primelemente in Polynomringen&Reduktionskriterium&Eisensteinsches Irreduzibilitätskriterium
Algebra 1,WS&2016,10,Charakteristik,3,,Charakteristik&Frobeniushomomorphismus
Algebra 1,WS&2016,11,Endliche und algebraische Körpererweiterungen,3,,Körpererweiterung&Gradsatz&algebraische (Un-)Abhängigkeit&algebraisches Element&transzendentes Element&algebraische Körpererweiterung&Minimalpolynom eines algebraischen Elements&Grad eines Elements einer Körpererweiterung&endlich erzeugte Körpererweiterung
Algebra 1,WS&2016,12,Algebraischer Abschluss,3,,Existenz eines algebraischen Abschlusses&Eindeutigkeit des algebraischen Abschlusses bis auf Isomorphie
Algebra 1,WS&2016,13,Zerfällungskörper,3,,Zerfällungskörper&normale Körpererweiterung&normale Hülle einer algebraischen Körpererweiterung
Algebra 1,WS&2016,14,Separable Körpererweiterungen,3,,separables Polynom&separable Körperweiterung&Separabilitätsgrad&separabler Abschluss&Satz vom primitiven Element
Algebra 1,WS&2016,15,Endliche Körper,3,,endlicher Körper&relativer Frobeniusautomorphismus
Algebra 1,WS&2016,16,Galoiserweiterungen,4,,Galoiserweiterung&Galoisgruppe&Fixkörper&Hauptsatz der Galoistheorie&abelsche Galoiserweiterung&Translationssatz der Galoistheorie
Algebra 1,WS&2016,17,Galoisgruppen von Polynomen,4,,Galoisgruppe eines Polynoms&Diskriminante eines Polynoms&Galoisgruppen kubischer Polynome&symmetrische rationale Funktion&elementarsymmetrisches Polynom&allgemeines Polynom n-ten Grades&Hauptsatz über symmetrische rationale Funktionen&Galoisgruppe des allgemeinen Polynom n-ten Grades
Algebra 1,WS&2016,18,Einheitswurzeln,4,,Einheitswurzel&primitive Einheitswurzel&zyklotomischer Charakter&Kreisteilungskörper und -polynome&Kreisteilungspolynome über endlichen Körpern
Algebra 1,WS&2016,19,Gruppenoperationen,5,,Gruppenoperation&Zentrum einer Gruppe&Bahn&Stabilisator&Bahnengleichung&Zentralisator&Normalisator
Algebra 1,WS&2016,20,Sylowgruppen,5,,p-Gruppe&p-Sylowgruppe&Sylowsätze&Anwendungen der Sylowsätze&Beweis der Sylowsätze
Algebra 1,WS&2016,21,Auflösbare Gruppen,5,,Kommutator&Kommutatorgruppe&Normalreihe&auflösbare Gruppe
Algebra 1,WS&2016,22,Norm und Hilberts Satz 90,6,,Norm in Körpererweiterungen&lineare Unabhängigkeit von Charakteren&Hilberts Satz 90
Algebra 1,WS&2016,23,Auflösbarkeit von Gleichungen,6,,durch Radikale auflösbare Körpererweiterung&auflösbare Körpererweiterung&Nichtauflösbarkeit des allgemeinen Polynoms n-ten Grades für n>=5
Algebra 1,WS&2016,24,Konstruktionen mit Zirkel und Lineal,6,,Konstruktionen mit Zirkel und Lineal&Konstruierbarkeit regelmäßiger n-Ecke&Unmöglichkeit von Würfelverdopplung mit Zirkel und Lineal&Unmöglichkeit von Winkeldreiteilung mit Zirkel und Lineal&Unmöglichkeit der Quadratur des Kreises mit Zirkel und Lineal
Algebra 2,SS&2017,1,Definitionen,1,1.1,Kategorie&kategorieller Monomorphismus&kategorieller Epimorphismus&kategorieller Isomorphismus&Funktor&Kategorienäquivalenz&Teilkategorie&natürliche Transformation&inverser Funktor&adjungierter Funktor&kategorielles Produkt&Differenzenkern
Algebra 2,SS&2017,2,Limiten und Kolimiten,1,1.2,kategorieller Limes&kategorieller Kolimes&Existenz kategorieller Limiten&Vertauschen von Limiten mit adjungierten Funktoren&Vertauschen von Limiten mit Limiten&filtrierte Kategorie&filtrierter Kolimes&Vertauschen von filtrierten Kolimiten mit endlichen Limiten in (Mengen)&filtrierte Limiten von endlichen Mengen&finaler Funktor
Algebra 2,SS&2017,3,Die Kategorie der Moduln über einem Ring,2,2.1,Modul&Bimodul&Modulhomomorphismus&Untermodul
Algebra 2,SS&2017,4,Erzeugendensysteme und freie Moduln,2,2.2,Erzeugendensystem eines Moduls&Basis eines freien Moduls&freier Modul
Algebra 2,SS&2017,5,Exaktheit,2,2.3,"exakte Folge von Moduln&Exaktheit von Produkten, Koprodukten, filtrierten Kolimiten in (R-Mod)&exakter Funktor in (R-Mod)&Halbexaktheit adjungierter Funktoren in (R-Mod)"
Algebra 2,SS&2017,6,Tensorprodukte,2,2.4,ausgewogene Abbildung&Tensorprodukt von Moduln&Konstruktion des Tensorprodukts&Adjunktion von Tensorprodukt und Hom-Funktor&Eigenschaften des Tensorprodukts von Moduln&Erzeuger des Tensorprodukts von Moduln&Tensorprodukt von Algebren
Algebra 2,SS&2017,7,"Injektive, projektive und flache Moduln",2,2.5,injektiver Modul&projektiver Modul&Charakterisierung projektiver und injektiver Moduln&Charaktergruppe einer abelschen Gruppe&Kofreier Modul&flacher Modul&Charakterisierung flacher Moduln&treuflacher Modul
Algebra 2,SS&2017,8,Noethersche und kohärente Moduln,2,2.6,Noetherscher Modul&Noetherscher Ring&endlich präsentierbarer Modul&kohärenter Modul&kohärenter Ring
Algebra 2,SS&2017,9,"Artinsche Moduln, Moduln endlicher Länge",2,2.7,Artinscher Modul&Moduln endlicher Länge&Satz von Jordan-Hölder
Algebra 2,SS&2017,10,Ideale,2,2.8,Ideal&Annullator eines Moduls&maximales Ideal&Jacobson-Radikal&nilpotentes Ideal&Nil-Ideal&Nakayama-Lemma&lokaler Ring&Erweiterung und Kontraktion von Idealen&treuflacher Ringhomomorphismus
Algebra 2,SS&2017,11,Halbeinfache Ringe,2,2.9,Charakterisierung halbeinfacher Moduln und Ringe&Artin-Wedderburn-Theorem
Algebra 2,SS&2017,12,"Artinsche, J-halbeinfache und semilokale Ringe",2,2.10,Artinscher Ring&J-halbeinfacher Ring&semilokaler Ring&semiprimärer Ring&Hopkins-Levitzki-Theorem
Algebra 2,SS&2017,13,Primideale und maximale Ideale,3,3.1,Primideal&Spektrum eines kommutativen Rings&Primidealvermeidungssatz
Algebra 2,SS&2017,14,Lokalisierung,3,3.2,Lokalisierung von Ringen und Moduln&Flachheit der Lokalisierung&Übertragen von Eigenschaften von Moduln auf ihre Lokalisierung&Spektrum der Lokalisierung&lokale Ringe des Spektrums&affine Basis der Zariski-Topologie&Quasi-Kompaktheit affiner Schemata&Bild eines Morphismus affiner Schemata
Algebra 2,SS&2017,15,Ganze Ringerweiterungen,3,3.3,endliche Algebra&endlich erzeugte Algebra&ganzes Element einer Algebra&ganze Algebra&Charakterisierung endlicher Algebren&ganzer Abschluss&Ganzabgeschlossenheit ist lokal&faktorielle Ringe sind ganz abgeschlossen&Going-up-Theorem&Incomparability
Algebra 2,SS&2017,16,Der Hilbertsche Nullstellensatz,3,3.4,Klassischer Hilbertscher Nullstellensatz&Jacobson-Ring&topologische Charakterisierung von Jacobson-Ringen und J-Halbeinfachheit&J-Halbeinfachheit von Polynomringen über Integritätsbereichen&J-Halbeinfachheit in endlich erzeugten Erweiterungen&verallgemeinerter Nullstellensatz&Beweis des klassischen Nullstellensatzes
Algebra 2,SS&2017,17,Abelsche Kategorien,4,4.1,additive Kategorie&abelsche Kategorie&Bild und Kobild von Morphismen&Exaktheit in abelschen Kategorien&Freyd-Mitchell-Einbettungssatz&Grothendieck-Kategorie
Algebra 2,SS&2017,18,Komplexe,4,4.2,Komplex&Homotopie von Morphismen von Komplexen&Homotopie-Äquivalenz&Quasi-Isomorphismus von Komplexen
Algebra 2,SS&2017,19,Injektive Auflösungen,4,4.3,njektive Auflösung
Algebra 2,SS&2017,20,Universelle Deltafunktoren,4,4.4,Deltafunktor&universeller Deltafunktor&Universalität auslöschbarer Deltafunktoren
Algebra 2,SS&2017,21,Abgeleitete Funktoren,4,4.5,abgeleiteter Funktor&abgeleitete Kategorie
Algebra 2,SS&2017,22,Kosimpliziale Objekte,4,4.6,kosimpliziales Objekt&Koketten-Komplex
